ID,Name,Handle,TweetText,TweetCreateTime,TweetURL,ReplyCount,QuoteCount,RetweetCount,LikeCount,BookmarkCount,Views,AllImageURL,VideoURL,Bio,CanDM,AccountCreateDate,Location,FollowersCount,FollowingCount,TotalFavouritesByUser,MediaCount,ProfileBannerURL,ProfileURL,AvatarURL,PostCount,Verified,IsBlueVerified
1353878826921549824,Costco Insider,@Costco_Insider,"Did you know Costco is distributing the Covid vaccine in some locations? https://t.co/wJQVkzbx3n Get all the details in our article!

#CovidVaccine #CostcoPharmacy #Costco #CostcoInsider",2021-01-25 17:34:00,https://x.com/Costco_Insider/status/1353878826921549824,2,0,1,3,0,-,,,"All the deals and coupons available at Costco as well as insider information about upcoming changes, products, and other tips to become an expert Costco shopper",false,2010-06-29 16:06:46,United States,10777,12,13,59,https://pbs.twimg.com/profile_banners/161079363/1549570519,https://x.com/Costco_Insider,https://pbs.twimg.com/profile_images/1079222232/Paper-Hole1_normal.gif,431,false,true
1357502127170461697,SCV Watcher,@ScvWatcher,"@Costco_Insider They're going to stop selling Mike Lindell's MY PILLOW when they want to take a chance on losing 75 million shoppers!

You better not COSTCO! You can kiss about half the country goodbye.",2021-02-04 17:31:42,https://x.com/ScvWatcher/status/1357502127170461697,0,0,0,0,0,-,,,"Not perfect Christian (LCMS) baby boomer Grandma. Grace & Sense of humor required. MAGA! 
Grace alone, Faith alone, Scripture alone.",false,2017-05-25 08:37:35,"Santa Clarita, CA",807,938,53402,4654,,https://x.com/ScvWatcher,https://pbs.twimg.com/profile_images/1096254198457327616/50VfdpP7_normal.jpg,49463,false,false